{
  "authoritative_legacy_remap_records": [
    {
      "artifact_id": "DOC-14",
      "authority_roles": {
        "executing_surfaces": [],
        "supporting_surfaces": [
          "docs/14_PR_CHAIN_ROADMAP.md"
        ]
      },
      "constitutional_maturity": "RATIFIED",
      "decision_evidence_refs": [
        "EVR-M0-DOC-14"
      ],
      "epistemic_rank_mapping": {
        "core_rank_mapping_status": "NO_LICENSED_MAPPING",
        "learning_rank_mapping_status": "NO_LICENSED_MAPPING",
        "lifecycle_epistemic_rank": "E1",
        "mapping_ref": null,
        "notes": "Lifecycle EpistemicRank labels are not automatically mapped to core or learning rank systems."
      },
      "evidence_posture": "CLASSIFICATION_ONLY",
      "generality_scope": "LOCAL",
      "historical_dependency_posture": "REORDERED_DEPENDENCY",
      "historical_mclt_ref": null,
      "historical_transition_status": "PARTIAL",
      "inferred_artifact_kind": "LegacyRepositoryArtifact",
      "inferred_lifecycle_slot": "SLGE-SDLC-M0",
      "notes": "Historical publication order is preserved while dependency representation is re-ordered under lifecycle ontology.",
      "observed_current_state": "PRESENT_IN_REPOSITORY",
      "quarantine_reason": null,
      "rebuild_requirement": null,
      "record_class": "AuthoritativeLegacyRemap",
      "release_maturity": "ALPHA",
      "remap_decision": "REORDER",
      "remap_id": "REMAP-DOC-14",
      "runtime_maturity": "ABSENT",
      "source_refs": [
        "docs/14_PR_CHAIN_ROADMAP.md"
      ],
      "trace_refs": [
        "docs/14_PR_CHAIN_ROADMAP.md"
      ],
      "unresolved_residual_refs": [
        "LEGACY_SLOT_MAPPING_UNCERTAIN",
        "HISTORICAL_MCLT_NOT_PROVEN"
      ]
    },
    {
      "artifact_id": "DOC-116",
      "authority_roles": {
        "executing_surfaces": [],
        "supporting_surfaces": [
          "docs/116_V1_CLOSURE_EVIDENCE_LEDGER.md"
        ]
      },
      "constitutional_maturity": "RATIFIED",
      "decision_evidence_refs": [
        "EVR-M0-DOC-116"
      ],
      "epistemic_rank_mapping": {
        "core_rank_mapping_status": "NO_LICENSED_MAPPING",
        "learning_rank_mapping_status": "NO_LICENSED_MAPPING",
        "lifecycle_epistemic_rank": "E1",
        "mapping_ref": null,
        "notes": "Lifecycle EpistemicRank labels are not automatically mapped to core or learning rank systems."
      },
      "evidence_posture": "CLASSIFICATION_ONLY",
      "generality_scope": "LOCAL",
      "historical_dependency_posture": "PRESERVED",
      "historical_mclt_ref": null,
      "historical_transition_status": "UNKNOWN",
      "inferred_artifact_kind": "LegacyRepositoryArtifact",
      "inferred_lifecycle_slot": "SLGE-SDLC-M0",
      "notes": "Legacy existence is preserved while historical transition proof remains explicitly bounded.",
      "observed_current_state": "PRESENT_IN_REPOSITORY",
      "quarantine_reason": null,
      "rebuild_requirement": null,
      "record_class": "AuthoritativeLegacyRemap",
      "release_maturity": "ALPHA",
      "remap_decision": "KEEP",
      "remap_id": "REMAP-DOC-116",
      "runtime_maturity": "ABSENT",
      "source_refs": [
        "docs/116_V1_CLOSURE_EVIDENCE_LEDGER.md"
      ],
      "trace_refs": [
        "docs/116_V1_CLOSURE_EVIDENCE_LEDGER.md"
      ],
      "unresolved_residual_refs": [
        "LEGACY_HISTORY_INCOMPLETE",
        "HISTORICAL_MCLT_NOT_PROVEN"
      ]
    },
    {
      "artifact_id": "DOC-119",
      "authority_roles": {
        "executing_surfaces": [],
        "supporting_surfaces": [
          "docs/119_GENERAL_ALGEBRA_OBSERVATORY_FOUNDATION_LAW.md"
        ]
      },
      "constitutional_maturity": "RATIFIED",
      "decision_evidence_refs": [
        "EVR-M0-DOC-119"
      ],
      "epistemic_rank_mapping": {
        "core_rank_mapping_status": "NO_LICENSED_MAPPING",
        "learning_rank_mapping_status": "NO_LICENSED_MAPPING",
        "lifecycle_epistemic_rank": "E1",
        "mapping_ref": null,
        "notes": "Lifecycle EpistemicRank labels are not automatically mapped to core or learning rank systems."
      },
      "evidence_posture": "CLASSIFICATION_ONLY",
      "generality_scope": "LOCAL",
      "historical_dependency_posture": "PRESERVED",
      "historical_mclt_ref": null,
      "historical_transition_status": "UNKNOWN",
      "inferred_artifact_kind": "LegacyRepositoryArtifact",
      "inferred_lifecycle_slot": "SLGE-SDLC-M0",
      "notes": "Legacy existence is preserved while historical transition proof remains explicitly bounded.",
      "observed_current_state": "PRESENT_IN_REPOSITORY",
      "quarantine_reason": null,
      "rebuild_requirement": null,
      "record_class": "AuthoritativeLegacyRemap",
      "release_maturity": "ALPHA",
      "remap_decision": "KEEP",
      "remap_id": "REMAP-DOC-119",
      "runtime_maturity": "ABSENT",
      "source_refs": [
        "docs/119_GENERAL_ALGEBRA_OBSERVATORY_FOUNDATION_LAW.md"
      ],
      "trace_refs": [
        "docs/119_GENERAL_ALGEBRA_OBSERVATORY_FOUNDATION_LAW.md"
      ],
      "unresolved_residual_refs": [
        "LEGACY_HISTORY_INCOMPLETE",
        "HISTORICAL_MCLT_NOT_PROVEN"
      ]
    },
    {
      "artifact_id": "DOC-120",
      "authority_roles": {
        "executing_surfaces": [],
        "supporting_surfaces": [
          "docs/120_EPISTEMIC_SELF_STATE_DERIVATION_LAW.md"
        ]
      },
      "constitutional_maturity": "RATIFIED",
      "decision_evidence_refs": [
        "EVR-M0-DOC-120"
      ],
      "epistemic_rank_mapping": {
        "core_rank_mapping_status": "NO_LICENSED_MAPPING",
        "learning_rank_mapping_status": "NO_LICENSED_MAPPING",
        "lifecycle_epistemic_rank": "E1",
        "mapping_ref": null,
        "notes": "Lifecycle EpistemicRank labels are not automatically mapped to core or learning rank systems."
      },
      "evidence_posture": "CLASSIFICATION_ONLY",
      "generality_scope": "LOCAL",
      "historical_dependency_posture": "PRESERVED",
      "historical_mclt_ref": null,
      "historical_transition_status": "UNKNOWN",
      "inferred_artifact_kind": "LegacyRepositoryArtifact",
      "inferred_lifecycle_slot": "SLGE-SDLC-M0",
      "notes": "Legacy existence is preserved while historical transition proof remains explicitly bounded.",
      "observed_current_state": "PRESENT_IN_REPOSITORY",
      "quarantine_reason": null,
      "rebuild_requirement": null,
      "record_class": "AuthoritativeLegacyRemap",
      "release_maturity": "ALPHA",
      "remap_decision": "KEEP",
      "remap_id": "REMAP-DOC-120",
      "runtime_maturity": "ABSENT",
      "source_refs": [
        "docs/120_EPISTEMIC_SELF_STATE_DERIVATION_LAW.md"
      ],
      "trace_refs": [
        "docs/120_EPISTEMIC_SELF_STATE_DERIVATION_LAW.md"
      ],
      "unresolved_residual_refs": [
        "LEGACY_HISTORY_INCOMPLETE",
        "HISTORICAL_MCLT_NOT_PROVEN"
      ]
    },
    {
      "artifact_id": "DOC-121",
      "authority_roles": {
        "executing_surfaces": [],
        "supporting_surfaces": [
          "docs/121_GENERAL_HYPOTHESIS_REGISTRY_LAW.md"
        ]
      },
      "constitutional_maturity": "RATIFIED",
      "decision_evidence_refs": [
        "EVR-M0-DOC-121"
      ],
      "epistemic_rank_mapping": {
        "core_rank_mapping_status": "NO_LICENSED_MAPPING",
        "learning_rank_mapping_status": "NO_LICENSED_MAPPING",
        "lifecycle_epistemic_rank": "E1",
        "mapping_ref": null,
        "notes": "Lifecycle EpistemicRank labels are not automatically mapped to core or learning rank systems."
      },
      "evidence_posture": "CLASSIFICATION_ONLY",
      "generality_scope": "LOCAL",
      "historical_dependency_posture": "PRESERVED",
      "historical_mclt_ref": null,
      "historical_transition_status": "UNKNOWN",
      "inferred_artifact_kind": "LegacyRepositoryArtifact",
      "inferred_lifecycle_slot": "SLGE-SDLC-M0",
      "notes": "Legacy existence is preserved while historical transition proof remains explicitly bounded.",
      "observed_current_state": "PRESENT_IN_REPOSITORY",
      "quarantine_reason": null,
      "rebuild_requirement": null,
      "record_class": "AuthoritativeLegacyRemap",
      "release_maturity": "ALPHA",
      "remap_decision": "KEEP",
      "remap_id": "REMAP-DOC-121",
      "runtime_maturity": "ABSENT",
      "source_refs": [
        "docs/121_GENERAL_HYPOTHESIS_REGISTRY_LAW.md"
      ],
      "trace_refs": [
        "docs/121_GENERAL_HYPOTHESIS_REGISTRY_LAW.md"
      ],
      "unresolved_residual_refs": [
        "LEGACY_HISTORY_INCOMPLETE",
        "HISTORICAL_MCLT_NOT_PROVEN"
      ]
    },
    {
      "artifact_id": "DOC-122",
      "authority_roles": {
        "executing_surfaces": [],
        "supporting_surfaces": [
          "docs/122_SIGNIFICATION_IDENTITY_AND_REPRESENTATION_PREREQUISITE_LAW.md"
        ]
      },
      "constitutional_maturity": "RATIFIED",
      "decision_evidence_refs": [
        "EVR-M0-DOC-122"
      ],
      "epistemic_rank_mapping": {
        "core_rank_mapping_status": "NO_LICENSED_MAPPING",
        "learning_rank_mapping_status": "NO_LICENSED_MAPPING",
        "lifecycle_epistemic_rank": "E1",
        "mapping_ref": null,
        "notes": "Lifecycle EpistemicRank labels are not automatically mapped to core or learning rank systems."
      },
      "evidence_posture": "CLASSIFICATION_ONLY",
      "generality_scope": "LOCAL",
      "historical_dependency_posture": "PRESERVED",
      "historical_mclt_ref": null,
      "historical_transition_status": "UNKNOWN",
      "inferred_artifact_kind": "LegacyRepositoryArtifact",
      "inferred_lifecycle_slot": "SLGE-SDLC-M0",
      "notes": "Legacy existence is preserved while historical transition proof remains explicitly bounded.",
      "observed_current_state": "PRESENT_IN_REPOSITORY",
      "quarantine_reason": null,
      "rebuild_requirement": null,
      "record_class": "AuthoritativeLegacyRemap",
      "release_maturity": "ALPHA",